<?xml version="1.0" encoding="UTF-8"?>
<xs:schema targetNamespace="http://genesis.uk.com/schemas/1.0/genesis-root" 
           elementFormDefault="qualified" 
           xmlns:xs="http://www.w3.org/2001/XMLSchema" 
           xmlns:genesis="http://genesis.uk.com/schemas/1.0/genesis-root">
    <xs:element name="genesis">
        <xs:annotation>
            <xs:documentation>The root element for a genesis configuration file.</xs:documentation>
        </xs:annotation>
        <xs:complexType>
            <xs:all>
                <xs:element ref="genesis:model" />
            </xs:all>
        </xs:complexType>
    </xs:element>
  
  <!-- The model element -->
    <xs:element name="model" type="genesis:ModelType">
        <xs:annotation>
            <xs:documentation>The model that Genesis should be working from.</xs:documentation>
        </xs:annotation>
    </xs:element>
  
  <!-- The model type -->
    <xs:complexType name="ModelType">
        <xs:sequence>
            <xs:element ref="genesis:object" minOccurs="0" maxOccurs="unbounded" />
        </xs:sequence>
    
    <!-- Reader that can interpret the model -->
        <xs:attribute name="reader" type="xs:string" use="required" />
    </xs:complexType>
  
  <!-- The object element -->
    <xs:element name="object" type="genesis:ObjectType">
        <xs:annotation>
            <xs:documentation>An object that can be configured within Genesis.</xs:documentation>
        </xs:annotation>
    </xs:element>
  
  <!-- The declaration of an object -->
    <xs:complexType name="ObjectType">
        <xs:sequence>
      <!-- Any executable actions -->
            <xs:element name="action" type="genesis:ActionType" minOccurs="0" maxOccurs="unbounded" />
      
       <!-- Any child objects  -->
            <xs:element ref="genesis:object" minOccurs="0" maxOccurs="unbounded" />
        </xs:sequence>  
  
    <!-- Name of the object -->
        <xs:attribute name="name" type="xs:string" use="required">
        </xs:attribute>
    </xs:complexType>

  <!-- An action that can be performed on an object -->
    <xs:complexType name="ActionType">
    <!-- The name of the action -->
        <xs:attribute name="name" type="xs:string" use="required" />
    
    <!-- The class that can handle the actions -->
        <xs:attribute name="handler" type="xs:string" use="required" />
    
    <!-- The other actions that need to be performed to make this action work -->
        <xs:attribute name="depends" type="xs:string" use="optional" />
    </xs:complexType>
</xs:schema>
