<?xml version="1.0" encoding="UTF-8"?>
<genesis xmlns:xsi="http://www.w3.org/2001/XMLSchema-instance" 
                xmlns="http://genesis.uk.com/schemas/1.0/genesis-root" 
                xmlns:fsmodel="http://genesis.uk.com/schemas/1.0/genesis-fs-model"
                xsi:schemaLocation="http://genesis.uk.com/schemas/1.0/genesis-root system/genesis.xsd http://genesis.uk.com/schemas/1.0/genesis-fs-model system/genesis-fs-model.xsd">
  <!-- The model that is being used by this Genesis instance -->
  <model reader="com.uk.genesis.model.FileSystemModelReader">
    <!-- Declare the location of the global xml -->
    <fsmodel:global filename="config/common.xml" />
  
    <!-- Declare the model using Genesis XML extensions namespace -->
    <fsmodel:object name="Enterprise" path="config/${name}" filename="enterprise.xml">
      <fsmodel:object name="Datacentre" path="physical/${name}" filename="datacentre.xml">
        <fsmodel:object name="Rack" path="${name}" filename="rack.xml">
          <fsmodel:object name="Node-00" filename="node-00-${name}.xml" />
          <fsmodel:object name="Node-01" filename="node-01-${name}.xml" />
          <fsmodel:object name="Node-02" filename="node-02-${name}.xml" />
        </fsmodel:object>
      </fsmodel:object>

      <fsmodel:object name="Service" path="logical/${name}" filename="programme.xml">
        <fsmodel:object name="Environment" path="${name}" filename="environment.xml">
          <fsmodel:object name="Application" path="${name}" filename="application.xml">
            <!-- You can package and deploy an application -->
            <action name="package" handler="com.uk.genesis.actions.XmlArchetypePackager" />
            <action name="deploy" handler="com.uk.genesis.actions.XmlArchetypeDeployer" depends="package" />
          </fsmodel:object>
        </fsmodel:object>
      </fsmodel:object>
    </fsmodel:object>
  </model>
</genesis>
